{
  "schema_version": "agentrouter-role-plan/1",
  "project_id": "proj_atlas",
  "title": "清结算增强：双组编排",
  "source": "external_ai",
  "goals": [
    "新增清结算增强链路",
    "与核心链路组隔离"
  ],
  "non_goals": [
    "不改动现有退款链路"
  ],
  "assumptions": [
    "核心链路组保持现状"
  ],
  "groups": [
    {
      "group_key": "g_settle",
      "display_name": "清结算组",
      "purpose": "清结算增强链路的实现与验证",
      "communication_boundary": "within_group_only",
      "workspace_strategy": "dedicated_worktree",
      "rules": {
        "handoff_requirements": [
          "实现完成必须交复核"
        ],
        "completion_definition": [
          "沙箱回归通过"
        ],
        "parallelism_notes": "组内串行写"
      }
    }
  ],
  "roles": [
    {
      "role_key": "r_settle_dev",
      "group_key": "g_settle",
      "display_name": "郑结算",
      "role_kind": "executor",
      "mission": "实现清结算增强链路",
      "responsibilities": [
        "清结算增强的代码实现"
      ],
      "out_of_scope": [
        "不改动退款链路"
      ],
      "accepted_inputs": [
        "组内任务"
      ],
      "required_outputs": [
        "结果摘要",
        "变更 diff"
      ],
      "default_completion_target": {
        "type": "role_key",
        "role_key": "r_settle_review"
      },
      "problem_target": {
        "type": "user"
      },
      "workspace_ref": "wt-settle",
      "requested_permissions": {
        "workspace_access": "read_write",
        "allowed_paths": [
          "~/work/pay-core/.worktrees/wt-settle"
        ],
        "tool_profiles": [
          "shell",
          "apply_patch"
        ],
        "network_profile": "custom_request",
        "notes": "需要访问清结算沙箱"
      },
      "runtime": {
        "harness": "codex",
        "provider_profile_id": "pp_codex_main",
        "model_id": "gpt-5-codex",
        "reasoning_effort": "高",
        "selection_source": "runtime"
      },
      "bootstrap_notes": "先读清结算现有设计文档"
    },
    {
      "role_key": "r_settle_review",
      "group_key": "g_settle",
      "display_name": "王清复",
      "role_kind": "reviewer",
      "mission": "复核清结算增强实现",
      "responsibilities": [
        "复核并决定是否交付用户"
      ],
      "out_of_scope": [
        "不直接改实现"
      ],
      "accepted_inputs": [
        "组内复核任务"
      ],
      "required_outputs": [
        "复核结论"
      ],
      "default_completion_target": {
        "type": "user"
      },
      "problem_target": {
        "type": "user"
      },
      "workspace_ref": "wt-settle",
      "requested_permissions": {
        "workspace_access": "read_only",
        "allowed_paths": [
          "~/work/pay-core/.worktrees/wt-settle"
        ],
        "tool_profiles": [
          "shell"
        ],
        "network_profile": "provider_only"
      },
      "runtime": {
        "harness": "pi",
        "provider_profile_id": "pp_pi_main",
        "model_id": "pi-pro",
        "reasoning_effort": "中",
        "selection_source": "seed"
      },
      "bootstrap_notes": ""
    }
  ],
  "review": {
    "requires_user_confirmation": true,
    "known_risks": [
      "郑结算请求了自定义网络权限（custom_request）",
      "王清复的模型来自种子目录，未验证"
    ]
  }
}